{
  "schema_version": 1,
  "lesson": "lesson-02",
  "pair": "fr-en",
  "target_lang": "fr",
  "meaning_lang": "en",
  "title": "Order a coffee",
  "speakers": { "a": "Customer", "b": "Waiter" },
  "target_voice": "ff_siwis",
  "meaning_voice": "af_heart",
  "format": "aac-m4a",
  "bitrate_kbps": 96,
  "loudness_lufs": -16.0,
  "items": [
    {
      "id": "s01",
      "speaker": "a",
      "target": "Bonjour, je voudrais un café.",
      "meaning": "Hello, I would like a coffee.",
      "speed": 0.87,
      "mode": "phrases",
      "target_file": "s01_target.m4a",
      "meaning_file": "s01_meaning.m4a",
      "target_seconds": 2.9,
      "meaning_seconds": 2.1
    },
    {
      "id": "s02",
      "speaker": "b",
      "target": "Bien sûr. Autre chose ?",
      "meaning": "Of course. Anything else?",
      "speed": 0.9,
      "mode": "whole",
      "target_file": "s02_target.m4a",
      "meaning_file": "s02_meaning.m4a",
      "target_seconds": 1.8,
      "meaning_seconds": 1.7
    }
  ],
  "end_cue": { "text": "The lesson is finished.", "file": "cues/en.m4a", "seconds": 1.4 }
}
